{
  "calls": [
    {
      "call_id": "call-minseung-20261015-142209",
      "started_at": "2026-10-15T14:22:13+09:00",
      "started_by": "person",
      "topic": null,
      "title": "도서관 가는 길, 오늘 할 일 정리",
      "title_source": "summary",
      "state": "ended",
      "duration_s": 372,
      "continues": null,
      "marks": {
        "report": false,
        "table": false,
        "chart": false,
        "bee_writes": 1
      },
      "results": [
        {
          "type": "bee_write",
          "id": "write-w1",
          "at": "2026-10-15T14:25:40+09:00",
          "kind": "todo_create",
          "text": "데모 영상 대본 다듬기",
          "state": "written",
          "will_retry": false,
          "undoable": false
        }
      ]
    },
    {
      "call_id": "call-minseung-20261015-012301",
      "started_at": "2026-10-15T01:23:05+09:00",
      "started_by": "person",
      "topic": null,
      "title": "맥북 에어와 프로, 코딩용으로 뭐가 나을까",
      "title_source": "summary",
      "state": "ended",
      "duration_s": 460,
      "continues": null,
      "marks": {
        "report": true,
        "table": true,
        "chart": true,
        "bee_writes": 2
      },
      "results": [
        {
          "type": "bee_write",
          "id": "write-w1",
          "at": "2026-10-15T01:23:30+09:00",
          "kind": "todo_create",
          "text": "토요일 촬영 장소 정하기",
          "state": "written",
          "will_retry": false,
          "undoable": false
        },
        {
          "type": "job",
          "id": "job-01",
          "at": "2026-10-15T01:27:03+09:00",
          "title": "코딩용 맥북 에어와 프로 한국 가격 비교",
          "state": "done",
          "started_at": "2026-10-15T01:25:36+09:00",
          "duration_s": 87,
          "step": null,
          "summary": "애플 한국 기준 에어는 1,590,000원, 프로는 2,390,000원부터예요. 파이썬과 가벼운 머신러닝을 밖에서 한다면 배터리와 무게에서 에어가 낫고, 프로는 노트북에서 모델을 학습시킬 때만 값을 해요.",
          "files": [
            {
              "name": "price-chart.svg",
              "kind": "chart",
              "url": "/calls/call-minseung-20261015-012301/files/jobs/01/price-chart.svg",
              "page_url": null,
              "title": "한국 가격(원), 에어와 프로, 세 가지 구성",
              "image_url": "/calls/call-minseung-20261015-012301/files/jobs/01/price-chart.png",
              "image_url_dark": "/calls/call-minseung-20261015-012301/files/jobs/01/price-chart-dark.png"
            },
            {
              "name": "report.md",
              "kind": "report",
              "url": "/calls/call-minseung-20261015-012301/files/jobs/01/report.md",
              "page_url": "/calls/call-minseung-20261015-012301/files/jobs/01/report.html",
              "title": null,
              "image_url": null,
              "image_url_dark": null
            },
            {
              "name": "comparison.csv",
              "kind": "table",
              "url": "/calls/call-minseung-20261015-012301/files/jobs/01/comparison.csv",
              "page_url": null,
              "title": null,
              "image_url": null,
              "image_url_dark": null
            }
          ],
          "failure": null
        },
        {
          "type": "bee_write",
          "id": "write-w2",
          "at": "2026-10-15T01:28:53+09:00",
          "kind": "fact_create",
          "text": "Works at the library almost every day",
          "state": "written",
          "will_retry": false,
          "undoable": false
        }
      ]
    },
    {
      "call_id": "call-minseung-20261014-214502",
      "started_at": "2026-10-14T21:45:06+09:00",
      "started_by": "person",
      "topic": null,
      "title": null,
      "title_source": "none",
      "state": "ended",
      "duration_s": 16,
      "continues": null,
      "marks": {
        "report": false,
        "table": false,
        "chart": false,
        "bee_writes": 0
      },
      "results": []
    },
    {
      "call_id": "call-minseung-20261014-180158",
      "started_at": "2026-10-14T18:02:11+09:00",
      "started_by": "ai",
      "topic": "성현이와 토요일 촬영 이야기",
      "title": "새 음성 메모: 성현이와 토요일 촬영 이야기",
      "title_source": "summary",
      "state": "ended",
      "duration_s": 124,
      "continues": null,
      "marks": {
        "report": false,
        "table": false,
        "chart": false,
        "bee_writes": 0
      },
      "results": []
    },
    {
      "call_id": "call-minseung-20261014-122604",
      "started_at": "2026-10-14T12:26:08+09:00",
      "started_by": "person",
      "topic": null,
      "title": "이번 주 비 소식, 토요일 북한산 등산은 괜찮을지",
      "title_source": "summary",
      "state": "ended",
      "duration_s": 60,
      "continues": null,
      "marks": {
        "report": false,
        "table": false,
        "chart": true,
        "bee_writes": 0
      },
      "results": [
        {
          "type": "job",
          "id": "job-01",
          "at": "2026-10-14T12:27:00+09:00",
          "title": "토요일 북한산 시간별 비 예보",
          "state": "done",
          "started_at": "2026-10-14T12:26:20+09:00",
          "duration_s": 40,
          "step": null,
          "summary": "토요일 오전에는 북한산 쪽 강수 확률이 20%를 넘지 않아요. 오후 2시부터 60%로 오르니 아침 일찍 출발해서 점심 전에 내려오면 괜찮아요.",
          "files": [
            {
              "name": "rain-chart.svg",
              "kind": "chart",
              "url": "/calls/call-minseung-20261014-122604/files/jobs/01/rain-chart.svg",
              "page_url": null,
              "title": "토요일 시간별 강수 확률(%)",
              "image_url": "/calls/call-minseung-20261014-122604/files/jobs/01/rain-chart.png",
              "image_url_dark": "/calls/call-minseung-20261014-122604/files/jobs/01/rain-chart-dark.png"
            }
          ],
          "failure": null
        }
      ]
    },
    {
      "call_id": "call-minseung-20261014-083100",
      "started_at": "2026-10-14T08:31:00+09:00",
      "started_by": "ai",
      "topic": "아이폰과 애플워치에 Bee 설정하기",
      "title": "아이폰과 애플워치에 Bee 설정하기",
      "title_source": "topic",
      "state": "missed",
      "duration_s": null,
      "continues": null,
      "marks": {
        "report": false,
        "table": false,
        "chart": false,
        "bee_writes": 0
      },
      "results": []
    }
  ],
  "more": true,
  "before": "MjAyNi0xMC0xNFQwODozMTowMCswOTowMHxjYWxsLW1pbnNldW5nLTIwMjYxMDE0LTA4MzEwMA",
  "version": "2a6de123b519c2b2"
}
